key	en	pl-PL	notes
hot_cold_guidance	hot & cold	gorące i zimne; cztery etapy: zimno, ciepło, gorąco, bardzo gorąco	Spójne z opisem produktu; brak słowa „feedback”
proximity_percent	proximity %	wskaźnik bliskości w procentach; „% bliskości”	Naturalnie, bez nadmiernych skrótów
find_my	Find My	Znajdź	Oficjalna nazwa w iOS (PL)
app_store_cta	download in App Store	Pobierz w App Store	Spójnie z Apple
category_productivity	Productivity	Produktywność	Kategoria App Store w PL
bluetooth_tech	Bluetooth	Bluetooth; „urządzenie Bluetooth”	Marka: Bluetooth Finder; technika: Bluetooth/Bluetooth
very_hot	very hot	bardzo gorąco	W treści: możliwość „na wskroś gorące” tylko jeśli tłumaczy UI